{
  "$schema": "https://json-schema.org/draft/2020-12/schema",
  "$id": "https://open-apollo.invalid/schema/plugin-recipes-v2.schema.json",
  "title": "Open Apollo plug-in art recipes, version 2",
  "description": "One file per plug-in panel spec (data/plugin-recipes/<spec>.json). A recipe regenerates a sprite on the user's machine from their own UAD install. It holds only facts about UA's files (file names and SHA-256, resource ids, byte ranges, blob SHA-256) and our operations, never pixels or UA text. Sprite ids share one namespace across files; the loader rejects duplicates. oa-assets runs the recipes (`oa-assets plugins`); plugin-ui reads the resulting manifest. Changes from plugin-recipes-v1: a recipe is a pipeline (`build`) whose first step is a source; decode modes for premultiplied 32-bit BMP, RT_BITMAP DIBs, JPEG, SVG and CRC-tolerant PNG; ops for stacks of crops from several blobs, fader/slider/meter/layer filmstrips, padded crops, arbitrary-size resampling and compositing; statuses runtime and deferred; the output hash is over RGBA pixels, not PNG bytes.",
  "type": "object",
  "additionalProperties": false,
  "required": ["recipesSchema", "group", "inputs", "uses", "sprites"],
  "properties": {
    "recipesSchema": {"const": 2},
    "group": {"type": "string", "pattern": "^[a-z0-9_.-]{1,96}$", "description": "the spec (capture) id"},
    "tier": {"type": "integer", "minimum": 0, "maximum": 4, "description": "coverage tier of the spec: 0 pixel-identical .. 4 code-drawn panel"},
    "inputs": {"type": "object", "additionalProperties": {"$ref": "#/$defs/input"}, "propertyNames": {"$ref": "#/$defs/inputId"}},
    "uses": {"type": "array", "items": {"$ref": "#/$defs/recipeId"}, "uniqueItems": true, "description": "every sprite id the spec draws, including ids defined in other files"},
    "blobs": {"type": "object", "additionalProperties": {"$ref": "#/$defs/blob"}, "propertyNames": {"type": "string", "pattern": "^[A-Za-z0-9_]{1,16}$"}, "description": "blobs named by load steps ({\"op\": \"load\", \"blob\": key}), so a blob used many times is written once"},
    "sprites": {"type": "object", "additionalProperties": {"$ref": "#/$defs/sprite"}, "propertyNames": {"$ref": "#/$defs/recipeId"}},
    "texts": {"type": "object", "additionalProperties": {"$ref": "#/$defs/text"}, "propertyNames": {"$ref": "#/$defs/recipeId"}}
  },
  "$defs": {
    "recipeId": {"type": "string", "pattern": "^[A-Za-z0-9][A-Za-z0-9_.+-]{0,127}$"},
    "inputId": {"type": "string", "pattern": "^dll:[^/\\\\]{1,160}$"},
    "sha256": {"type": "string", "pattern": "^[0-9a-f]{64}$"},
    "pipeline": {"type": "array", "minItems": 1, "items": {"$ref": "#/$defs/op"}, "description": "the first op is a source (load, canvas, sprite, stack, thumb-fader, slide, layers); the rest are steps on the current image"},
    "input": {
      "type": "object", "additionalProperties": false, "required": ["kind", "file", "root"],
      "properties": {
        "kind": {"const": "dll"},
        "file": {"type": "string", "maxLength": 200, "description": "file name inside the Powered Plugins folder, matched ignoring case"},
        "root": {"const": "powered-plugins"},
        "sha256": {"type": "array", "items": {"$ref": "#/$defs/sha256"}, "description": "file versions the recipes were made from; other versions are still tried, every blob is checked by its own hash"},
        "bytes": {"type": "integer", "minimum": 0},
        "thirdParty": {"type": "string", "maxLength": 64}
      }
    },
    "status": {
      "enum": ["verified", "fallback", "runtime", "deferred", "no-recipe"],
      "description": "verified: built from the install and the RGBA hash equals the reference art's; fallback: built from the install, on purpose not identical to the reference art (LANCZOS 2x of the DLL's 1x art where the reference was LUNA/hand art, similar DLL art for live-captured sprites, SVG rasterized by resvg), output.rgba is the hash of our build; runtime: drawn by plugin-ui code (owner, kind); deferred: part of a code-drawn panel that is out of scope for now, so the spec is not ready and the console shows the generic panel; no-recipe: nothing in the install can make it"
    },
    "sprite": {
      "type": "object", "additionalProperties": false, "required": ["status"],
      "properties": {
        "status": {"$ref": "#/$defs/status"},
        "basis": {"type": "string", "maxLength": 32, "description": "why: exact, derived, equivalent, dll-composite, similar, scaled, synth, derived-svg, live, luna, ..."},
        "owner": {"type": "string", "maxLength": 64, "description": "runtime/deferred: who draws it, e.g. plugin-ui/chrome"},
        "kind": {"type": "string", "maxLength": 32, "description": "runtime/deferred: chrome, text, vector, similar, scaled, ..."},
        "build": {"$ref": "#/$defs/pipeline"},
        "output": {
          "type": "object", "additionalProperties": false, "required": ["w", "h"],
          "properties": {
            "w": {"type": "integer", "minimum": 1}, "h": {"type": "integer", "minimum": 1},
            "rgba": {"$ref": "#/$defs/sha256", "description": "SHA-256 over u32le width, u32le height and the RGBA8 rows with R,G,B zeroed where alpha is 0"}
          }
        }
      },
      "allOf": [
        {"if": {"properties": {"status": {"enum": ["verified", "fallback"]}}}, "then": {"required": ["build", "output"]}},
        {"if": {"properties": {"status": {"enum": ["runtime", "deferred"]}}}, "then": {"required": ["kind"]}}
      ]
    },
    "blob": {
      "type": "object", "required": ["in", "sha", "dec"],
      "properties": {"op": {"const": "load"}, "in": {"$ref": "#/$defs/inputId"},
        "res": {"type": "string", "pattern": "^[^/]+/[^/]+/[0-9]+$", "description": "PE resource TYPE/NAME/LANG (numeric ids in decimal)"},
        "carve": {"type": "array", "items": {"type": "integer", "minimum": 0}, "minItems": 2, "maxItems": 2, "description": "[file offset, length]; when the bytes there differ, the blob is searched for by length and hash"},
        "sha": {"$ref": "#/$defs/sha256", "description": "SHA-256 of the blob bytes"},
        "dec": {"enum": ["png", "png-raw", "jpeg", "bmp", "bmp-premultiplied", "dib", "dib-premultiplied", "mpk1", "svg-z1", "svg-z2"],
          "description": "png: CRC/Adler errors tolerated, tEXt InterleaveX/InterleaveY (Softube MPACK) undone; png-raw: rows as stored; jpeg: baseline, libjpeg-turbo ISLOW output; bmp/dib: Pillow's BMP rules (32-bit BI_RGB ignores alpha); *-premultiplied: 32-bit BGRA with alpha kept and colour divided by it in float32, truncated (all-zero alpha = opaque); mpk1: Softube zlib BGRA; svg-zN: resvg 0.48.1 at N times the document size, no fonts"}},
      "additionalProperties": false,
      "oneOf": [{"required": ["res"]}, {"required": ["carve"]}]
    },
    "box": {"type": "array", "items": {"type": "integer"}, "minItems": 4, "maxItems": 4},
    "axisMotion": {"type": "array", "items": {"type": "integer"}, "minItems": 3, "maxItems": 3, "description": "[base, span, dir]: position = base + round(t * span), t = v (dir 1), 1 - v (dir -1), 0 (dir 0); round() ties to even"},
    "op": {
      "type": "object", "required": ["op"],
      "oneOf": [
        {"additionalProperties": false, "required": ["op"],
         "properties": {"op": {"const": "load"}, "blob": {"type": "string", "pattern": "^[A-Za-z0-9_]{1,16}$"},
           "in": true, "res": true, "carve": true, "sha": true, "dec": true},
         "oneOf": [
           {"required": ["blob"], "not": {"anyOf": [{"required": ["in"]}, {"required": ["res"]}, {"required": ["carve"]}, {"required": ["sha"]}, {"required": ["dec"]}]}},
           {"not": {"required": ["blob"]}, "$ref": "#/$defs/blob"}],
         "description": "decode a blob: a key of the file's blobs table, or the blob spelled out inline"},
        {"additionalProperties": false, "required": ["op", "w", "h"],
         "properties": {"op": {"const": "canvas"}, "w": {"type": "integer", "minimum": 0}, "h": {"type": "integer", "minimum": 0},
           "rgba": {"type": "array", "items": {"type": "integer", "minimum": 0, "maximum": 255}, "minItems": 4, "maxItems": 4}}},
        {"additionalProperties": false, "required": ["op", "id"], "properties": {"op": {"const": "sprite"}, "id": {"$ref": "#/$defs/recipeId"}}},
        {"additionalProperties": false, "required": ["op", "parts"],
         "properties": {"op": {"const": "stack"}, "parts": {"type": "array", "minItems": 1, "items": {"$ref": "#/$defs/pipeline"}},
           "axis": {"enum": ["x", "y"], "description": "parts pasted one after another without blending; default y"}}},
        {"additionalProperties": false, "required": ["op", "track", "thumb", "w", "h", "k"],
         "properties": {"op": {"const": "thumb-fader"}, "track": {"$ref": "#/$defs/pipeline"}, "thumb": {"$ref": "#/$defs/pipeline"},
           "w": {"type": "integer"}, "h": {"type": "integer"}, "k": {"type": "integer", "minimum": 1}},
           "description": "JUCE 1.52 fader: travel = w - thumb.w (w >= h) or h - thumb.h; n = travel // k + 1 frames; frame i = track with thumb alpha-composited at off = round(i * travel / (n - 1)) (centred across)"},
        {"additionalProperties": false, "required": ["op", "thumb", "n", "w", "h", "x", "y"],
         "properties": {"op": {"const": "slide"}, "thumb": {"$ref": "#/$defs/pipeline"}, "n": {"type": "integer", "minimum": 2},
           "w": {"type": "integer"}, "h": {"type": "integer"}, "x": {"$ref": "#/$defs/axisMotion"}, "y": {"$ref": "#/$defs/axisMotion"}},
           "description": "n frames of w x h; v = i / (n - 1); thumb alpha-composited at (max(x, 0), i * h + max(y, 0))"},
        {"additionalProperties": false, "required": ["op", "n", "layers"],
         "properties": {"op": {"const": "layers"}, "n": {"type": "integer", "minimum": 1},
           "layers": {"type": "array", "items": {"type": "object", "additionalProperties": false, "required": ["src", "frames"],
             "properties": {"src": {"$ref": "#/$defs/pipeline"}, "frames": {"type": "integer", "minimum": 1}}}}},
           "description": "n frames of (max width) x (max frame height); frame k alpha-composites frame k of every layer (a 1-frame layer repeats)"},
        {"additionalProperties": false, "required": ["op", "box"], "properties": {"op": {"const": "crop"}, "box": {"$ref": "#/$defs/box", "description": "[x, y, w, h]; outside the image is transparent"}}},
        {"additionalProperties": false, "required": ["op"], "properties": {"op": {"const": "lanczos2x"}}},
        {"additionalProperties": false, "required": ["op", "w", "h", "filter"],
         "properties": {"op": {"const": "resize"}, "w": {"type": "integer", "minimum": 1}, "h": {"type": "integer", "minimum": 1},
           "filter": {"enum": ["lanczos", "bicubic", "bilinear", "hamming", "box", "nearest"]},
           "box": {"type": "array", "items": {"type": "number"}, "minItems": 4, "maxItems": 4, "description": "source region [x0, y0, x1, y1]"}},
           "description": "Pillow 12.3.0 Image.resize: separable fixed-point convolution; RGBA is premultiplied around it"},
        {"additionalProperties": false, "required": ["op", "src", "at"],
         "properties": {"op": {"const": "paste"}, "src": {"$ref": "#/$defs/pipeline"},
           "at": {"type": "array", "items": {"type": "integer"}, "minItems": 2, "maxItems": 2},
           "blend": {"enum": ["over", "replace", "mask"], "description": "over (default): Pillow alpha_composite; replace: Image.paste; mask: Image.paste with src as its own mask"}}},
        {"additionalProperties": false, "required": ["op", "n", "vertical"],
         "properties": {"op": {"const": "meter-fill"}, "n": {"type": "integer", "minimum": 2}, "vertical": {"type": "boolean"}},
           "description": "n frames; frame k shows the image cut at round(H * (1 - k/(n-1))) from the top (vertical) or round(W * k/(n-1)) from the left"},
        {"additionalProperties": false, "required": ["op", "axis"], "properties": {"op": {"const": "flip"}, "axis": {"enum": ["x", "y"]}}},
        {"additionalProperties": false, "required": ["op", "rgb", "a"],
         "properties": {"op": {"const": "premul-tint"}, "rgb": {"type": "array", "items": {"type": "integer", "minimum": 0, "maximum": 255}, "minItems": 3, "maxItems": 3},
           "a": {"type": "integer", "minimum": 0, "maximum": 256}},
         "description": "Brainworx disabled-control tint: for alpha al > 0, each colour c with target t becomes min(255, round_half_even((c*al*(256-a) + t*a*256) / 65536)); alpha unchanged"},
        {"additionalProperties": false, "required": ["op"], "properties": {"op": {"const": "juce-premul-roundtrip"}},
         "description": "JUCE load-time premultiply undone: alpha 255 keeps colour, alpha 0 clears it, else c = ((c*al + 127) >> 8) * 255 // al"}
      ]
    },
    "text": {
      "type": "object", "additionalProperties": false, "required": ["status", "kind", "input", "at", "encoding", "output"],
      "properties": {
        "status": {"$ref": "#/$defs/status"},
        "kind": {"enum": ["dll-string", "dll-string-table"], "description": "dll-string: a NUL-terminated string -> Text/<id>.txt; dll-string-table: count fixed-stride NUL-padded strings -> Text/<id>.json (compact JSON list)"},
        "input": {"$ref": "#/$defs/inputId"},
        "at": {"type": "object", "additionalProperties": false, "required": ["fileOffset"],
          "properties": {"fileOffset": {"type": "integer", "minimum": 0}, "length": {"type": "integer", "minimum": 1}}},
        "stride": {"type": "integer", "minimum": 1}, "count": {"type": "integer", "minimum": 1},
        "encoding": {"enum": ["utf-8", "latin-1"]},
        "output": {"type": "object", "additionalProperties": false, "required": ["sha256"],
          "properties": {"sha256": {"$ref": "#/$defs/sha256"}, "bytes": {"type": "integer"}, "items": {"type": "integer"}}}
      }
    }
  }
}
