{"recipesSchema":2,"group":"fuchs_overdrive_supreme_50","tier":2,"inputs":{"dll:UAD Ampeg B15N.dll":{"kind":"dll","file":"UAD Ampeg B15N.dll","root":"powered-plugins","sha256":["8eca571d0f4875a148991d0596c1ec1f715dad7a8d78135c8af439ca67289ea3"]},"dll:UAD Friedman BE100.dll":{"kind":"dll","file":"UAD Friedman BE100.dll","root":"powered-plugins","sha256":["ba1e91cdb54f5a3bb1be9ceb7dbb0ccd672a2508fae1f81d52cced5f8b80ef05"]},"dll:UAD Friedman DS40.dll":{"kind":"dll","file":"UAD Friedman DS40.dll","root":"powered-plugins","sha256":["a0de367fef182f2bdd7c6b40be56893e11831a8099ccb022f6278401e631edb2"]},"dll:UAD Fuchs Overdrive Supreme 50.dll":{"kind":"dll","file":"UAD Fuchs Overdrive Supreme 50.dll","root":"powered-plugins","sha256":["e5d7662763b71c0f415acfccb303ef7748f6dca9e767014f157765140d5b2548"]}},"uses":["J_fuchs_overdrive_supreme_50_background_tb","J_fuchs_overdrive_supreme_50_tb_bank","J_fuchs_overdrive_supreme_50_tb_power","J_fuchs_overdrive_supreme_50_tb_rack","fuchs_overdrive_supreme_50__BUTTON","fuchs_overdrive_supreme_50__LED","fuchs_overdrive_supreme_50__LEDRED","fuchs_overdrive_supreme_50__POTI","fuchs_overdrive_supreme_50__POTIPUSHPULL_C0","fuchs_overdrive_supreme_50__POTIPUSHPULL_C1","fuchs_overdrive_supreme_50__POWERLED","fuchs_overdrive_supreme_50__POWERSWITCH","fuchs_overdrive_supreme_50__RACK","fuchs_overdrive_supreme_50__SWITCH","fuchs_overdrive_supreme_50__SWITCH3POS"],"blobs":{
"b0":{"in":"dll:UAD Ampeg B15N.dll","res":"PNG/TOOLBARRACKBNT.PNG/1033","sha":"d45dea7be38754e283eafdea8dcaecb869695044d8ead47be83472f397465b13","dec":"png"},
"b1":{"in":"dll:UAD Friedman DS40.dll","res":"PNG/BUTTON.PNG/1033","sha":"0604cbaed2b03cfcd2c1b571ccfc32e42bce20fd59aac1a6b782ad85706435a4","dec":"png"},
"b2":{"in":"dll:UAD Fuchs Overdrive Supreme 50.dll","res":"PNG/LED.PNG/1033","sha":"3d5e04d86e6738537f164dc8393aaf3206a517bb7059116ae824491c18870957","dec":"png"},
"b3":{"in":"dll:UAD Friedman BE100.dll","res":"PNG/LEDRED.PNG/1033","sha":"ca893f4e08b95be6b4d173f876f9056adbf18abca0f129a75fc1cf8812e417b4","dec":"png"},
"b4":{"in":"dll:UAD Fuchs Overdrive Supreme 50.dll","res":"PNG/POTI.PNG/1033","sha":"d85a38b8ff6cedc43eb5ecef05897392f886125efecd219efb80eb2fc63739f6","dec":"png"},
"b5":{"in":"dll:UAD Fuchs Overdrive Supreme 50.dll","res":"PNG/POTIPUSHPULL.PNG/1033","sha":"b85b9566c9c850e9077a5cd71d8f0bc2994ff940e442e857eacce200cc38bf6f","dec":"png"},
"b6":{"in":"dll:UAD Fuchs Overdrive Supreme 50.dll","res":"PNG/POWERLED.PNG/1033","sha":"1a74c7fa91fb7b4429122e7367ad8244850115415208c696bdf4f5f62fc52ae0","dec":"png"},
"b7":{"in":"dll:UAD Fuchs Overdrive Supreme 50.dll","res":"PNG/POWERSWITCH.PNG/1033","sha":"02d18513591102e4c657a7891b483c501ab7ac06e03f40f6ea8ea9a98010a5d9","dec":"png"},
"b8":{"in":"dll:UAD Fuchs Overdrive Supreme 50.dll","res":"PNG/RACK.PNG/1033","sha":"325d25f8a426e56831dc39298284744a4a04dfd83a87e5ff1eeeeee20ffed951","dec":"png"},
"b9":{"in":"dll:UAD Fuchs Overdrive Supreme 50.dll","res":"PNG/SWITCH.PNG/1033","sha":"a9a182b1647bf64191e2a71b5458cf8b609de90cebf2e7c7740276539731c05f","dec":"png"},
"b10":{"in":"dll:UAD Fuchs Overdrive Supreme 50.dll","res":"PNG/SWITCH3POS.PNG/1033","sha":"a998a21e32f606b149b925db2cf2150116f863c23ddd3020f96c54a0a532099b","dec":"png"}
},"sprites":{
"J_fuchs_overdrive_supreme_50_background_tb":{"status":"runtime","basis":"live","owner":"plugin-ui/chrome","kind":"chrome"},
"J_fuchs_overdrive_supreme_50_tb_bank":{"status":"runtime","basis":"live","owner":"plugin-ui/chrome","kind":"chrome"},
"J_fuchs_overdrive_supreme_50_tb_power":{"status":"runtime","basis":"live","owner":"plugin-ui/chrome","kind":"chrome"},
"J_fuchs_overdrive_supreme_50_tb_rack":{"status":"verified","basis":"exact","build":[{"op":"load","blob":"b0"}],"output":{"w":110,"h":96,"rgba":"efd4fee22dd4549a4981fc60164d82e1a1d9f522f8c9f3be11298a733f02766b"}},
"fuchs_overdrive_supreme_50__BUTTON":{"status":"verified","basis":"exact","build":[{"op":"load","blob":"b1"}],"output":{"w":50,"h":100,"rgba":"d97ed79a7ded501b86c60d79ccaeee6a355a12605a8a1fb97d8f6924c1d9c7e1"}},
"fuchs_overdrive_supreme_50__LED":{"status":"verified","basis":"exact","build":[{"op":"load","blob":"b2"}],"output":{"w":30,"h":60,"rgba":"a464d153e7bd73004523735e982a4c1169b414e4ae1604f3b4260dcc2dd1564e"}},
"fuchs_overdrive_supreme_50__LEDRED":{"status":"verified","basis":"exact","build":[{"op":"load","blob":"b3"}],"output":{"w":48,"h":96,"rgba":"c711cc400bc8bada3978f45b9e2364108d060856a533d92fe4debe0b8eaa65a5"}},
"fuchs_overdrive_supreme_50__POTI":{"status":"verified","basis":"exact","build":[{"op":"load","blob":"b4"}],"output":{"w":136,"h":8296,"rgba":"e8b82a2054c3ddf82c8eafa462eb639a4df9d387d9544feea592e76d0d0bd0be"}},
"fuchs_overdrive_supreme_50__POTIPUSHPULL_C0":{"status":"verified","basis":"derived","build":[{"op":"load","blob":"b5"},{"op":"crop","box":[0,0,136,8296]}],"output":{"w":136,"h":8296,"rgba":"b069cc83c4d7d0143f3000d35697acc8d7ba798aaf1aebe8f4e9c5f7b564e3fd"}},
"fuchs_overdrive_supreme_50__POTIPUSHPULL_C1":{"status":"verified","basis":"derived","build":[{"op":"load","blob":"b5"},{"op":"crop","box":[136,0,136,8296]}],"output":{"w":136,"h":8296,"rgba":"14ace246c1ac4ad6a1b4cd30e72f998f5bafcde396e4d156652f9e59ea6669c5"}},
"fuchs_overdrive_supreme_50__POWERLED":{"status":"verified","basis":"exact","build":[{"op":"load","blob":"b6"}],"output":{"w":278,"h":544,"rgba":"27f3e6f0aeab258e0fe69516bf30d6cbfbd0de02792b2debc9afa8540cfc2ed5"}},
"fuchs_overdrive_supreme_50__POWERSWITCH":{"status":"verified","basis":"exact","build":[{"op":"load","blob":"b7"}],"output":{"w":90,"h":220,"rgba":"fdc253db62fa11bc84fd913ba19e8b7483f3e957c0858e1ce3bd08b0d1252fb3"}},
"fuchs_overdrive_supreme_50__RACK":{"status":"verified","basis":"exact","build":[{"op":"load","blob":"b8"}],"output":{"w":2048,"h":582,"rgba":"8be0e9eb7d66bbacbf2bcd274db5597aa2938688ca1f1f022e55aba07bc80fd8"}},
"fuchs_overdrive_supreme_50__SWITCH":{"status":"verified","basis":"exact","build":[{"op":"load","blob":"b9"}],"output":{"w":64,"h":156,"rgba":"a076baebcf87e24cc9237eba5f92cd750002dd90d36e91df133387913cebd06e"}},
"fuchs_overdrive_supreme_50__SWITCH3POS":{"status":"verified","basis":"exact","build":[{"op":"load","blob":"b10"}],"output":{"w":64,"h":234,"rgba":"ba13a38009cc991eb845a268c271b154978ec73d3e34495488e4697e43ee90b5"}}
}}
