{"recipesSchema":2,"group":"ada_std_1_stereo_tapped_delay","tier":2,"inputs":{"dll:UAD ADA STD-1 Stereo Tapped Delay.dll":{"kind":"dll","file":"UAD ADA STD-1 Stereo Tapped Delay.dll","root":"powered-plugins","sha256":["ef6b824fb4b4dae1f987ee7f66f28346ebaa7faa2ae9f9bb7030885f89188c55"]}},"uses":["J_ada_std_1_stereo_tapped_delay_background_tb","J_ada_std_1_stereo_tapped_delay_tb_0x200938c0","J_ada_std_1_stereo_tapped_delay_tb_bank","J_ada_std_1_stereo_tapped_delay_tb_knob_21","J_ada_std_1_stereo_tapped_delay_tb_power","Q_ada_switch_c1","ada_std_1_stereo_tapped_delay__CLIP","ada_std_1_stereo_tapped_delay__KNOB","ada_std_1_stereo_tapped_delay__KNOB2","ada_std_1_stereo_tapped_delay__KNOB3","ada_std_1_stereo_tapped_delay__LABELS","ada_std_1_stereo_tapped_delay__METER","ada_std_1_stereo_tapped_delay__POWERLED","ada_std_1_stereo_tapped_delay__SWITCHGREEN_C0","ada_std_1_stereo_tapped_delay__SWITCHGREEN_C1","ada_std_1_stereo_tapped_delay__SWITCHRED_C0","ada_std_1_stereo_tapped_delay__SWITCHRED_C1","ada_std_1_stereo_tapped_delay__SWITCH_C0"],"blobs":{
"b0":{"in":"dll:UAD ADA STD-1 Stereo Tapped Delay.dll","res":"PNG/TOOLBARLIMITBTN.PNG/1033","sha":"6640c29da42b2e875a098d237282435ad225b1c54c87d10d9a8a77ef999117f5","dec":"png"},
"b1":{"in":"dll:UAD ADA STD-1 Stereo Tapped Delay.dll","res":"PNG/SWITCH.PNG/1033","sha":"9dc7215f630a59f16847dd365485f0e271e279421daef9b2c8900ff5889530a2","dec":"png"},
"b2":{"in":"dll:UAD ADA STD-1 Stereo Tapped Delay.dll","res":"PNG/CLIP.PNG/1033","sha":"b5fbcb47b92238cd084e7b89f7878dedb3081cc9b4da06c37e96f85294d3569b","dec":"png"},
"b3":{"in":"dll:UAD ADA STD-1 Stereo Tapped Delay.dll","res":"PNG/KNOB.PNG/1033","sha":"c9de3ff561a905252e36b942128289ebf7ec71415d2ea14942377a5c4eea9e8b","dec":"png"},
"b4":{"in":"dll:UAD ADA STD-1 Stereo Tapped Delay.dll","res":"PNG/KNOB2.PNG/1033","sha":"a4f5d2ebdfeaf27ee16b7eccc3653903741583d46dfde136fbfd01aa1453315a","dec":"png"},
"b5":{"in":"dll:UAD ADA STD-1 Stereo Tapped Delay.dll","res":"PNG/KNOB3.PNG/1033","sha":"a50bd86635637b87e9557559176b029cf0321a62d82a642a67f25cd6688dcb02","dec":"png"},
"b6":{"in":"dll:UAD ADA STD-1 Stereo Tapped Delay.dll","res":"PNG/LABELS.PNG/1033","sha":"b5b26cff948fd25ab7c0dc5386a8fd4e90bc821b1e3c9ceae3aded0d5c57212e","dec":"png"},
"b7":{"in":"dll:UAD ADA STD-1 Stereo Tapped Delay.dll","res":"PNG/METER.PNG/1033","sha":"8eddb03d1b6a66ac1e89e84603a4c5e6a1471cb1e17da1b6577f1f0916eb2443","dec":"png"},
"b8":{"in":"dll:UAD ADA STD-1 Stereo Tapped Delay.dll","res":"PNG/POWERLED.PNG/1033","sha":"284f2ab6f4bbd246309140bfab5b8be32f2c43d78a2f35e571810b25ec4537ef","dec":"png"},
"b9":{"in":"dll:UAD ADA STD-1 Stereo Tapped Delay.dll","res":"PNG/SWITCHGREEN.PNG/1033","sha":"2c41750ef119e8e218887476699bca75591f54e991b5e0b170de443183aaf59e","dec":"png"},
"b10":{"in":"dll:UAD ADA STD-1 Stereo Tapped Delay.dll","res":"PNG/SWITCHRED.PNG/1033","sha":"781e0becf3b860a0607773d50664d8694b8cceac2ad86682f2bcc67e2c8a825c","dec":"png"}
},"sprites":{
"J_ada_std_1_stereo_tapped_delay_background_tb":{"status":"runtime","basis":"live","owner":"plugin-ui/chrome","kind":"chrome"},
"J_ada_std_1_stereo_tapped_delay_tb_0x200938c0":{"status":"verified","basis":"exact","build":[{"op":"load","blob":"b0"}],"output":{"w":270,"h":96,"rgba":"60adb0d81e3af3845269562485c83e367466d5b2ff4cecdbf906545da1402864"}},
"J_ada_std_1_stereo_tapped_delay_tb_bank":{"status":"runtime","basis":"live","owner":"plugin-ui/chrome","kind":"chrome"},
"J_ada_std_1_stereo_tapped_delay_tb_knob_21":{"status":"runtime","basis":"live","owner":"plugin-ui/chrome","kind":"chrome"},
"J_ada_std_1_stereo_tapped_delay_tb_power":{"status":"runtime","basis":"live","owner":"plugin-ui/chrome","kind":"chrome"},
"Q_ada_switch_c1":{"status":"verified","basis":"derived","build":[{"op":"load","blob":"b1"},{"op":"crop","box":[34,0,34,192]}],"output":{"w":34,"h":192,"rgba":"e38fca4a60fcfbb9463f7b2d99691449edf63c23baa5a34b4f902dbea37fd169"}},
"ada_std_1_stereo_tapped_delay__CLIP":{"status":"verified","basis":"exact","build":[{"op":"load","blob":"b2"}],"output":{"w":20,"h":40,"rgba":"c120d61c3b19e53345e822be40cd01f859fcb3a187711b033d0e0d4568b08c03"}},
"ada_std_1_stereo_tapped_delay__KNOB":{"status":"verified","basis":"exact","build":[{"op":"load","blob":"b3"}],"output":{"w":116,"h":7076,"rgba":"72bf5d5b7c54b5e42212e58dc97f0120429536a8865b30c63f56fe98d532617b"}},
"ada_std_1_stereo_tapped_delay__KNOB2":{"status":"verified","basis":"exact","build":[{"op":"load","blob":"b4"}],"output":{"w":116,"h":7076,"rgba":"edd5f476cd83a2bde8f1dd7a88e04950265e3fca4e97b82711f7d9840fa46017"}},
"ada_std_1_stereo_tapped_delay__KNOB3":{"status":"verified","basis":"exact","build":[{"op":"load","blob":"b5"}],"output":{"w":116,"h":7076,"rgba":"7b1bca39de2609793ceb9a4c7fc825e662d17269d6cdc50e9de1839fdcf96a35"}},
"ada_std_1_stereo_tapped_delay__LABELS":{"status":"verified","basis":"exact","build":[{"op":"load","blob":"b6"}],"output":{"w":1154,"h":414,"rgba":"a277c90ed43350242541e85d1920bdc0cec4f0441b9cc9081cc8f663dc5f4190"}},
"ada_std_1_stereo_tapped_delay__METER":{"status":"verified","basis":"exact","build":[{"op":"load","blob":"b7"}],"output":{"w":20,"h":2890,"rgba":"0ddc6545d2646cbde79567df2037fab86ead5132431c76eca92aaf48a4721a5c"}},
"ada_std_1_stereo_tapped_delay__POWERLED":{"status":"verified","basis":"exact","build":[{"op":"load","blob":"b8"}],"output":{"w":24,"h":56,"rgba":"586ee582435bba3c7a71df5e7ee6e3665ab9c98fa42180d802233208b5719cc2"}},
"ada_std_1_stereo_tapped_delay__SWITCHGREEN_C0":{"status":"verified","basis":"derived","build":[{"op":"load","blob":"b9"},{"op":"crop","box":[0,0,34,236]}],"output":{"w":34,"h":236,"rgba":"31d3ec122e66abd21020f33b7c441d95925a1f69ed5a452debb2458b95d91661"}},
"ada_std_1_stereo_tapped_delay__SWITCHGREEN_C1":{"status":"verified","basis":"derived","build":[{"op":"load","blob":"b9"},{"op":"crop","box":[34,0,34,236]}],"output":{"w":34,"h":236,"rgba":"76a3968aeae94671f07ef83974e85d741f8bc18b67f99535320708311dfae047"}},
"ada_std_1_stereo_tapped_delay__SWITCHRED_C0":{"status":"verified","basis":"derived","build":[{"op":"load","blob":"b10"},{"op":"crop","box":[0,0,34,236]}],"output":{"w":34,"h":236,"rgba":"59feaffc9f1e7a2bd804a2131398c501ebe1637ddc5767e707d8f2ffcc9dff37"}},
"ada_std_1_stereo_tapped_delay__SWITCHRED_C1":{"status":"verified","basis":"derived","build":[{"op":"load","blob":"b10"},{"op":"crop","box":[34,0,34,236]}],"output":{"w":34,"h":236,"rgba":"f96d3df207b6cb777127e0a3e10fef72ee9b6e1a4868bbe039cd24f6b7421e5c"}},
"ada_std_1_stereo_tapped_delay__SWITCH_C0":{"status":"verified","basis":"derived","build":[{"op":"load","blob":"b1"},{"op":"crop","box":[0,0,34,192]}],"output":{"w":34,"h":192,"rgba":"f4760de47b728f9f4712e261e2e58813bbb7952f6255d75c37d698d3cb36be9b"}}
}}
