{"recipesSchema":2,"group":"precision_enhancer_hz","tier":1,"inputs":{"dll:UAD Precision Enhancer Hz.dll":{"kind":"dll","file":"UAD Precision Enhancer Hz.dll","root":"powered-plugins","sha256":["5d3bf26af8fc09206e0986da36a414412efd49578c4455d2101d8fe2251f8213"]}},"uses":["precision_enhancer_hz_4207","precision_enhancer_hz_5501","precision_enhancer_hz_5503","precision_enhancer_hz_5504","precision_enhancer_hz_5505","precision_enhancer_hz_5510_3","precision_enhancer_hz_5601","precision_enhancer_hz_5608_7","precision_enhancer_hz_6928","precision_enhancer_hz_6929"],"blobs":{
"b0":{"in":"dll:UAD Precision Enhancer Hz.dll","res":"10/4207/1033","sha":"b1f252f6081ae2a0fc499ac56e86b00bcac660b541d945a18a58d213cc5fd78f","dec":"bmp-premultiplied"},
"b1":{"in":"dll:UAD Precision Enhancer Hz.dll","res":"10/5501/1033","sha":"b0aaa2bfd5f7b24174201a2119beb7c63c8100a2a129b2a8912bd397b946d049","dec":"bmp"},
"b2":{"in":"dll:UAD Precision Enhancer Hz.dll","res":"10/5503/1033","sha":"f11e51f742bec597c33aef88e72d42c325bd402b413212820bf0bf2081e40347","dec":"bmp-premultiplied"},
"b3":{"in":"dll:UAD Precision Enhancer Hz.dll","res":"10/5504/1033","sha":"bd98c4608320aea24579cc598187bd9935c9a1e21145465bbe14918711eb7a69","dec":"bmp-premultiplied"},
"b4":{"in":"dll:UAD Precision Enhancer Hz.dll","res":"10/5505/1033","sha":"3331ff683642a60ab8ff6068f78480cf337f312358ec3ff1a7a98d4e6578e07e","dec":"bmp-premultiplied"},
"b5":{"in":"dll:UAD Precision Enhancer Hz.dll","res":"10/5510/1033","sha":"ef8963ef0203f3bd5bd394b59dca920e57269cdd41a1631700690bf7726f883d","dec":"bmp-premultiplied"},
"b6":{"in":"dll:UAD Precision Enhancer Hz.dll","res":"10/5601/1033","sha":"6f7e5dabe5bda094b1db6f4a9a317d566b8346ce790c8c44473ad2be48cb346b","dec":"bmp-premultiplied"},
"b7":{"in":"dll:UAD Precision Enhancer Hz.dll","res":"10/5608/1033","sha":"c97435038afa9583a7972c730252d4c584f3658f62983741fca515c06187c072","dec":"bmp-premultiplied"},
"b8":{"in":"dll:UAD Precision Enhancer Hz.dll","res":"10/6928/1033","sha":"077271a2d561caa9e7e5a847fdbc24340e9922889350e9494172ef11d65a1721","dec":"bmp"},
"b9":{"in":"dll:UAD Precision Enhancer Hz.dll","res":"10/6929/1033","sha":"b54795b4e4b98357e67ccb3c8733c4d1fb2a0596dbb077b8b7bbfc124863f1cf","dec":"bmp-premultiplied"}
},"sprites":{
"precision_enhancer_hz_4207":{"status":"verified","basis":"derived","build":[{"op":"load","blob":"b0"},{"op":"crop","box":[0,0,38,48]},{"op":"lanczos2x"}],"output":{"w":76,"h":96,"rgba":"eaf1e6bb6859401696e0cb0cb94bc9fa4663ae4d050e39ab01c13a19df9c61fd"}},
"precision_enhancer_hz_5501":{"status":"fallback","basis":"equivalent","build":[{"op":"load","blob":"b1"},{"op":"crop","box":[0,0,53,90]},{"op":"lanczos2x"}],"output":{"w":106,"h":180,"rgba":"53bc0d4e36acd42ae1609e718ee8b84cde38712255aec35839e12e0e2aec5cb2"}},
"precision_enhancer_hz_5503":{"status":"verified","basis":"derived","build":[{"op":"load","blob":"b2"},{"op":"crop","box":[0,0,15,901]},{"op":"lanczos2x"}],"output":{"w":30,"h":1802,"rgba":"a61f78be8791e8addcb969392cfd0d2ef1dbff23922ad01c432387f3021e6d1d"}},
"precision_enhancer_hz_5504":{"status":"verified","basis":"derived","build":[{"op":"load","blob":"b3"},{"op":"crop","box":[0,0,6,901]},{"op":"lanczos2x"}],"output":{"w":12,"h":1802,"rgba":"ae84001cae4c7a0bb5ebfe3f21722398be940513298570f4997005b5d611b46e"}},
"precision_enhancer_hz_5505":{"status":"verified","basis":"derived","build":[{"op":"load","blob":"b4"},{"op":"crop","box":[0,0,6,8]},{"op":"lanczos2x"}],"output":{"w":12,"h":16,"rgba":"fe256041e4d843cf765dc5b7fcb05ac7794b6af1dfe6489efce23200de83094b"}},
"precision_enhancer_hz_5510_3":{"status":"verified","basis":"derived","build":[{"op":"stack","parts":[[{"op":"load","blob":"b5"},{"op":"crop","box":[0,0,54,34]}],[{"op":"load","blob":"b5"},{"op":"crop","box":[0,34,54,34]}]]},{"op":"lanczos2x"}],"output":{"w":108,"h":136,"rgba":"830bff03822e0a77e4215f09dbae262d265a3c7716fff20e5f1351f8f5f1cdef"}},
"precision_enhancer_hz_5601":{"status":"verified","basis":"derived","build":[{"op":"load","blob":"b6"},{"op":"crop","box":[0,0,46,1968]},{"op":"lanczos2x"}],"output":{"w":92,"h":3936,"rgba":"29bab39f9fd632a21e9452e5fbbf405aa3bf0f75558c9d0158afec2c7f8472d1"}},
"precision_enhancer_hz_5608_7":{"status":"verified","basis":"derived","build":[{"op":"stack","parts":[[{"op":"load","blob":"b7"},{"op":"crop","box":[0,0,24,24]}],[{"op":"load","blob":"b7"},{"op":"crop","box":[0,24,24,24]}]]},{"op":"lanczos2x"}],"output":{"w":48,"h":96,"rgba":"d499e99c9a2963d95f14f0ae0de129a0d87187431c2a76d638e648155938b4cf"}},
"precision_enhancer_hz_6928":{"status":"fallback","basis":"equivalent","build":[{"op":"load","blob":"b8"},{"op":"crop","box":[0,0,720,65]},{"op":"lanczos2x"}],"output":{"w":1440,"h":130,"rgba":"82a6d6e664afc5698f0246248803eb916e004c41fa4ef8cb10a64fe9dcba8873"}},
"precision_enhancer_hz_6929":{"status":"verified","basis":"derived","build":[{"op":"load","blob":"b9"},{"op":"crop","box":[0,0,55,72]},{"op":"lanczos2x"}],"output":{"w":110,"h":144,"rgba":"afe7fadcea7e696ad4a24d3a6ed256407435638f0aa233751e34544e98bee251"}}
}}
