{"recipesSchema":2,"group":"precision_limiter","tier":1,"inputs":{"dll:UAD Precision Limiter.dll":{"kind":"dll","file":"UAD Precision Limiter.dll","root":"powered-plugins","sha256":["4a8080d8862e199423d474f8ca92c76c09bde45d32715fea8deb7aaee39c964d"]}},"uses":["P_precision_limiter_m_base_0x5b0","P_precision_limiter_m_base_0x788","P_precision_limiter_m_gr_hold_rev","P_precision_limiter_m_gr_rev","P_precision_limiter_m_k12n_base_0x788","P_precision_limiter_m_k12n_lvl_l","P_precision_limiter_m_k12n_peak_l","P_precision_limiter_m_k12z_base_0x788","P_precision_limiter_m_k12z_lvl_l","P_precision_limiter_m_k12z_peak_l","P_precision_limiter_m_k14n_base_0x788","P_precision_limiter_m_k14n_lvl_l","P_precision_limiter_m_k14n_peak_l","P_precision_limiter_m_k14z_base_0x788","P_precision_limiter_m_k14z_lvl_l","P_precision_limiter_m_k14z_peak_l","P_precision_limiter_m_k20n_base_0x788","P_precision_limiter_m_k20n_lvl_l","P_precision_limiter_m_k20n_peak_l","P_precision_limiter_m_k20z_base_0x788","P_precision_limiter_m_k20z_lvl_l","P_precision_limiter_m_k20z_peak_l","P_precision_limiter_m_lvl_l","P_precision_limiter_m_pkz_base_0x5b0","P_precision_limiter_m_pkz_base_0x788","P_precision_limiter_m_pkz_gr_hold_rev","P_precision_limiter_m_pkz_gr_rev","P_precision_limiter_m_pkz_lvl_l","P_precision_limiter_m_pkz_peak_l","P_precision_limiter_zone-10-power","precision_limiter_3600","precision_limiter_3601","precision_limiter_3602","precision_limiter_3603","precision_limiter_3604","precision_limiter_3611","precision_limiter_3612","precision_limiter_3613","precision_limiter_3614","precision_limiter_4207"],"blobs":{
"b0":{"in":"dll:UAD Precision Limiter.dll","res":"10/4206/1033","sha":"4e0ac254d9749345d60d27478f170d873bd4d60463a937b1d1c955e3b19c9196","dec":"bmp-premultiplied"},
"b1":{"in":"dll:UAD Precision Limiter.dll","res":"10/3600/1033","sha":"77a321199928db278c71c7f4053bb41f4a332146e9372fd6fd9851d4b43e28d1","dec":"bmp"},
"b2":{"in":"dll:UAD Precision Limiter.dll","res":"10/3601/1033","sha":"2e4cc87cbb87e5f5248d7e057ee572326c20d200f0d7bf03a1946ab0670a1fac","dec":"bmp-premultiplied"},
"b3":{"in":"dll:UAD Precision Limiter.dll","res":"10/3602/1033","sha":"91859d2adc971a0f91b1894c718a0c7d5beff894552f2f4452d4a65585ec93e4","dec":"bmp"},
"b4":{"in":"dll:UAD Precision Limiter.dll","res":"10/3603/1033","sha":"abe9538a48f25951650b7362631d12f5ca09f007a7cf4f4ed2e4116fb1fc1d6f","dec":"bmp"},
"b5":{"in":"dll:UAD Precision Limiter.dll","res":"10/3604/1033","sha":"10a5f7fbef4670db8a45d525f27d306ea71365bf136e69de657b6b171546f2ff","dec":"bmp"},
"b6":{"in":"dll:UAD Precision Limiter.dll","res":"10/3611/1033","sha":"a22bb0c40dbe3eb10d91b23f9282a258cf4213418ca4813e3688f13d8aeadd00","dec":"bmp"},
"b7":{"in":"dll:UAD Precision Limiter.dll","res":"10/3612/1033","sha":"121dc9f1c83ad02375117f2e2a8947c4017a4a6dd90f6e5cd6a643e95bb04e84","dec":"bmp"},
"b8":{"in":"dll:UAD Precision Limiter.dll","res":"10/3613/1033","sha":"aca532c7db4cbbc2b5fcabb53a2663732af831cd4274ab0b5931c09edda5c36b","dec":"bmp"},
"b9":{"in":"dll:UAD Precision Limiter.dll","res":"10/3614/1033","sha":"c75ebcbac32f4af09f38902643310635e465c7fb111d54097352ba92fe06093b","dec":"bmp"},
"b10":{"in":"dll:UAD Precision Limiter.dll","res":"10/4207/1033","sha":"b1f252f6081ae2a0fc499ac56e86b00bcac660b541d945a18a58d213cc5fd78f","dec":"bmp-premultiplied"}
},"sprites":{
"P_precision_limiter_m_base_0x5b0":{"status":"no-recipe","basis":"dll-composite","kind":"todo"},
"P_precision_limiter_m_base_0x788":{"status":"no-recipe","basis":"dll-composite","kind":"todo"},
"P_precision_limiter_m_gr_hold_rev":{"status":"no-recipe","basis":"dll-composite","kind":"todo"},
"P_precision_limiter_m_gr_rev":{"status":"no-recipe","basis":"dll-composite","kind":"todo"},
"P_precision_limiter_m_k12n_base_0x788":{"status":"no-recipe","basis":"dll-composite","kind":"todo"},
"P_precision_limiter_m_k12n_lvl_l":{"status":"no-recipe","basis":"dll-composite","kind":"todo"},
"P_precision_limiter_m_k12n_peak_l":{"status":"no-recipe","basis":"dll-composite","kind":"todo"},
"P_precision_limiter_m_k12z_base_0x788":{"status":"no-recipe","basis":"dll-composite","kind":"todo"},
"P_precision_limiter_m_k12z_lvl_l":{"status":"no-recipe","basis":"dll-composite","kind":"todo"},
"P_precision_limiter_m_k12z_peak_l":{"status":"no-recipe","basis":"dll-composite","kind":"todo"},
"P_precision_limiter_m_k14n_base_0x788":{"status":"no-recipe","basis":"dll-composite","kind":"todo"},
"P_precision_limiter_m_k14n_lvl_l":{"status":"no-recipe","basis":"dll-composite","kind":"todo"},
"P_precision_limiter_m_k14n_peak_l":{"status":"no-recipe","basis":"dll-composite","kind":"todo"},
"P_precision_limiter_m_k14z_base_0x788":{"status":"no-recipe","basis":"dll-composite","kind":"todo"},
"P_precision_limiter_m_k14z_lvl_l":{"status":"no-recipe","basis":"dll-composite","kind":"todo"},
"P_precision_limiter_m_k14z_peak_l":{"status":"no-recipe","basis":"dll-composite","kind":"todo"},
"P_precision_limiter_m_k20n_base_0x788":{"status":"no-recipe","basis":"dll-composite","kind":"todo"},
"P_precision_limiter_m_k20n_lvl_l":{"status":"no-recipe","basis":"dll-composite","kind":"todo"},
"P_precision_limiter_m_k20n_peak_l":{"status":"no-recipe","basis":"dll-composite","kind":"todo"},
"P_precision_limiter_m_k20z_base_0x788":{"status":"no-recipe","basis":"dll-composite","kind":"todo"},
"P_precision_limiter_m_k20z_lvl_l":{"status":"no-recipe","basis":"dll-composite","kind":"todo"},
"P_precision_limiter_m_k20z_peak_l":{"status":"no-recipe","basis":"dll-composite","kind":"todo"},
"P_precision_limiter_m_lvl_l":{"status":"no-recipe","basis":"dll-composite","kind":"todo"},
"P_precision_limiter_m_pkz_base_0x5b0":{"status":"no-recipe","basis":"dll-composite","kind":"todo"},
"P_precision_limiter_m_pkz_base_0x788":{"status":"no-recipe","basis":"dll-composite","kind":"todo"},
"P_precision_limiter_m_pkz_gr_hold_rev":{"status":"no-recipe","basis":"dll-composite","kind":"todo"},
"P_precision_limiter_m_pkz_gr_rev":{"status":"no-recipe","basis":"dll-composite","kind":"todo"},
"P_precision_limiter_m_pkz_lvl_l":{"status":"no-recipe","basis":"dll-composite","kind":"todo"},
"P_precision_limiter_m_pkz_peak_l":{"status":"no-recipe","basis":"dll-composite","kind":"todo"},
"P_precision_limiter_zone-10-power":{"status":"fallback","basis":"equivalent","build":[{"op":"load","blob":"b0"},{"op":"lanczos2x"}],"output":{"w":134,"h":160,"rgba":"7eabaf04cf0b38d53ec32cf1005c43c0578d466a64c182e5d4f9462c62c394e8"}},
"precision_limiter_3600":{"status":"verified","basis":"derived","build":[{"op":"load","blob":"b1"},{"op":"crop","box":[0,0,720,130]},{"op":"lanczos2x"}],"output":{"w":1440,"h":260,"rgba":"8ec6d5da1dd1beb099edc77a17a3abb917d81b3b2e24956f9db44262ceb26919"}},
"precision_limiter_3601":{"status":"verified","basis":"derived","build":[{"op":"load","blob":"b2"},{"op":"crop","box":[0,0,93,5070]},{"op":"lanczos2x"}],"output":{"w":186,"h":10140,"rgba":"21424e9726fe50de62f19c1cded82b830c35e07b0ec9ad29a3c468e1e04d22dc"}},
"precision_limiter_3602":{"status":"verified","basis":"derived","build":[{"op":"load","blob":"b3"},{"op":"crop","box":[0,0,40,1776]},{"op":"lanczos2x"}],"output":{"w":80,"h":3552,"rgba":"de2c7b677045e20aa65b222169bc6c6accb831442f739fe9103d47d2e3f3362a"}},
"precision_limiter_3603":{"status":"verified","basis":"derived","build":[{"op":"load","blob":"b4"},{"op":"crop","box":[0,0,40,1680]},{"op":"lanczos2x"}],"output":{"w":80,"h":3360,"rgba":"a934bc346e7feda9887faf14380b1c33ce43a7dd229f00da31d114709b29b84b"}},
"precision_limiter_3604":{"status":"verified","basis":"derived","build":[{"op":"load","blob":"b5"},{"op":"crop","box":[0,0,28,36]},{"op":"lanczos2x"}],"output":{"w":56,"h":72,"rgba":"ae7e236dcf2d56e2c59d434ef7254c8b4df3935e20e53685b05b48a99c3e3b30"}},
"precision_limiter_3611":{"status":"verified","basis":"derived","build":[{"op":"load","blob":"b6"},{"op":"crop","box":[0,0,50,46]},{"op":"lanczos2x"}],"output":{"w":100,"h":92,"rgba":"21779e715a4ad851a8ebe3e389e1e6f311634560d9c200a70a53019575d4c753"}},
"precision_limiter_3612":{"status":"verified","basis":"derived","build":[{"op":"load","blob":"b7"},{"op":"crop","box":[0,0,50,46]},{"op":"lanczos2x"}],"output":{"w":100,"h":92,"rgba":"b0b91529ef5c4b0e1f2310eea21e8e7e54dd4a6963fd877732d82e79f7e9d0f0"}},
"precision_limiter_3613":{"status":"verified","basis":"derived","build":[{"op":"load","blob":"b8"},{"op":"crop","box":[0,0,59,69]},{"op":"lanczos2x"}],"output":{"w":118,"h":138,"rgba":"e92a4e33790c02ecda2549a098858adc47e0fe4342fbb4f3d40ab228aafb3c75"}},
"precision_limiter_3614":{"status":"verified","basis":"derived","build":[{"op":"load","blob":"b9"},{"op":"crop","box":[0,0,91,92]},{"op":"lanczos2x"}],"output":{"w":182,"h":184,"rgba":"774bacd3ab175ed4590f8421e509b7526d1237eb2551f33c57305e005cb7075e"}},
"precision_limiter_4207":{"status":"verified","basis":"derived","build":[{"op":"load","blob":"b10"},{"op":"crop","box":[0,0,38,48]},{"op":"lanczos2x"}],"output":{"w":76,"h":96,"rgba":"eaf1e6bb6859401696e0cb0cb94bc9fa4663ae4d050e39ab01c13a19df9c61fd"}}
}}
